{
  "accepted_lenses": [
    "execution-risk",
    "retrieval-economics",
    "scriptability"
  ],
  "agreement": true,
  "artifact_id": "gibberish-forge",
  "base_revision": 2,
  "blockers": [],
  "bundle_digest": "sha256:bec5b3572a36f48118a8cf1c6b040438ef705eedc7211de1edb51bdb2d99ffb4",
  "contributions": 3,
  "evidence_digest": "none",
  "exhausted": false,
  "id": "gibberish-forge-review-state-2",
  "kind": "review-state",
  "missing_lenses": [],
  "next_revision": 2,
  "producer": "reducer",
  "review_id": "gibberish-forge-review",
  "schema_version": 1,
  "status": "agreement"
}
